{
  "schemaVersion": "0.1.0",
  "settlementId": "es-torrevieja",
  "kind": "landscape-treatments",
  "status": "production-candidate-catalog",
  "items": [
    {
      "id": "ua-lr-mediterranean",
      "sourceSettlementLandscapeId": "lr-mediterranean",
      "name": "Mediterranean coastal water context",
      "landscapeType": "sea",
      "stage": "unmaterialized",
      "geometry": null,
      "materials": [],
      "lods": []
    },
    {
      "id": "ua-lr-laguna-torrevieja",
      "sourceSettlementLandscapeId": "lr-laguna-torrevieja",
      "name": "Laguna de Torrevieja",
      "landscapeType": "lagoon",
      "stage": "unmaterialized",
      "geometry": null,
      "materials": [],
      "lods": []
    },
    {
      "id": "ua-lr-laguna-mata",
      "sourceSettlementLandscapeId": "lr-laguna-mata",
      "name": "Laguna de La Mata",
      "landscapeType": "lagoon",
      "stage": "unmaterialized",
      "geometry": null,
      "materials": [],
      "lods": []
    },
    {
      "id": "ua-lr-natural-park",
      "sourceSettlementLandscapeId": "lr-natural-park",
      "name": "Parque Natural de las Lagunas de La Mata y Torrevieja — coarse protected-land envelope",
      "landscapeType": "protected-land",
      "stage": "unmaterialized",
      "geometry": null,
      "materials": [],
      "lods": []
    },
    {
      "id": "ua-lr-salt-industry-fringe",
      "sourceSettlementLandscapeId": "lr-salt-industry-fringe",
      "name": "Salt-industry / salina operational fringe",
      "landscapeType": "wetland",
      "stage": "unmaterialized",
      "geometry": null,
      "materials": [],
      "lods": []
    },
    {
      "id": "ua-lr-n332-corridor",
      "sourceSettlementLandscapeId": "lr-n332-corridor",
      "name": "N-332 / major bypass infrastructure corridor",
      "landscapeType": "infrastructure",
      "stage": "unmaterialized",
      "geometry": null,
      "materials": [],
      "lods": []
    }
  ]
}
